title,company,role,city,work_mode,experience,exp_min,exp_max,exp_avg,salary,description,skills,url,combined_text,extracted_skills,skill_count,skills_list,extracted_skills_str
Machine Learning Engineer,Capgemini,ML Engineer,Bengaluru,Hybrid,5-9 Yrs,5,9,7.0,Not disclosed,"Proficiency in Python and ML libraries (NumPy, Pandas, Scikit-learn)Preferred candidate...","artificial intelligence, machine learning, python, machine, intelligence",https://www.naukri.com/job-listings-machine-learning-engineer-capgemini-bengaluru-5-to-9-years-020226016724,"Proficiency in Python and ML libraries (NumPy, Pandas, Scikit-learn)Preferred candidate... artificial intelligence, machine learning, python, machine, intelligence",[],5,"['artificial intelligence', 'machine learning', 'python', 'machine', 'intelligence']","artificial intelligence, machine learning, python, machine, intelligence"
Machine Learning Engineer,eBay,ML Engineer,Bengaluru,On-site,1-3 Yrs,1,3,2.0,Not disclosed,. MS in Computer Science or related area with 1+ years of relevant work experience (or ...,"computer science, administration, gcp, machine learning, scala, cloud, mongodb, research",https://www.naukri.com/job-listings-machine-learning-engineer-ebay-bengaluru-1-to-3-years-160226503648,". MS in Computer Science or related area with 1+ years of relevant work experience (or ... computer science, administration, gcp, machine learning, scala, cloud, mongodb, research",[],8,"['computer science', 'administration', 'gcp', 'machine learning', 'scala', 'cloud', 'mongodb', 'research']","computer science, administration, gcp, machine learning, scala, cloud, mongodb, research"
Machine Learning Engineer,Spikewell,ML Engineer,Bhubaneswar,On-site,1-3 Yrs,1,3,2.0,Not disclosed,"Candidate with Bachelors / Masters in CS, Data Science, or AI, 1+ years of ML experienc...","data handling, artificial intelligence, data analysis, machine learning, statistics, algorithms, documentation, workflow",https://www.naukri.com/job-listings-machine-learning-engineer-spikewell-bhubaneswar-1-to-3-years-190226029429,"Candidate with Bachelors / Masters in CS, Data Science, or AI, 1+ years of ML experienc... data handling, artificial intelligence, data analysis, machine learning, statistics, algorithms, documentation, workflow",[],8,"['data handling', 'artificial intelligence', 'data analysis', 'machine learning', 'statistics', 'algorithms', 'documentation', 'workflow']","data handling, artificial intelligence, data analysis, machine learning, statistics, algorithms, documentation, workflow"
Machine Learning Engineer 2,Adobe,ML Engineer,Noida,On-site,2-4 Yrs,2,4,3.0,Not disclosed,"We are seeking an Applied Research Specialist with a background in Computer Science, Co...","graphics, geometry, c++, image processing, illustrator, machine learning, animation, adobe",https://www.naukri.com/job-listings-machine-learning-engineer-2-adobe-systems-india-pvt-ltd-noida-2-to-4-years-110226503656,"We are seeking an Applied Research Specialist with a background in Computer Science, Co... graphics, geometry, c++, image processing, illustrator, machine learning, animation, adobe",[],8,"['graphics', 'geometry', 'c++', 'image processing', 'illustrator', 'machine learning', 'animation', 'adobe']","graphics, geometry, c++, image processing, illustrator, machine learning, animation, adobe"
Machine Learning Engineer,Micro1,ML Engineer,Kolkata,On-site,2-5 Yrs,2,5,3.5,Not disclosed,"Job Title: Machine Learning Engineer Job Type: Full-time, Contractor About Us: Our miss...","machine learning algorithms, machine learning, aws, mongodb, artificial intelligence, communication skills, ml, machine",https://www.naukri.com/job-listings-machine-learning-engineer-micro1-kolkata-mumbai-new-delhi-hyderabad-pune-chennai-bengaluru-2-to-5-years-290425501301,"Job Title: Machine Learning Engineer Job Type: Full-time, Contractor About Us: Our miss... machine learning algorithms, machine learning, aws, mongodb, artificial intelligence, communication skills, ml, machine",[],8,"['machine learning algorithms', 'machine learning', 'aws', 'mongodb', 'artificial intelligence', 'communication skills', 'ml', 'machine']","machine learning algorithms, machine learning, aws, mongodb, artificial intelligence, communication skills, ml, machine"
Machine Learning Data Engineer,Blueoptima,ML Engineer,Bengaluru,On-site,2-7 Yrs,2,7,4.5,Not disclosed,Job Description  We are seeking a ML Data Engineer with a wealth of experience creating...,"gis, automation, prototype, project management, machine learning, analytics, sql, python",https://www.naukri.com/job-listings-machine-learning-data-engineer-blueoptima-bengaluru-2-to-7-years-190226504978,"Job Description  We are seeking a ML Data Engineer with a wealth of experience creating... gis, automation, prototype, project management, machine learning, analytics, sql, python",[],8,"['gis', 'automation', 'prototype', 'project management', 'machine learning', 'analytics', 'sql', 'python']","gis, automation, prototype, project management, machine learning, analytics, sql, python"
Machine Learning Engineer (Speech) - AI,Level Ai,ML Engineer,Kolkata,On-site,2-6 Yrs,2,6,4.0,Not disclosed,Requirements : . Bachelors in Computer Science or Electrical Engineering or related fie...,"computer science, asr, linux, transcription, enterprise applications, machine learning, agile, information retrieval",https://www.naukri.com/job-listings-machine-learning-engineer-speech-ai-levelai-kolkata-mumbai-new-delhi-hyderabad-pune-chennai-bengaluru-2-to-6-years-030524501412,"Requirements : . Bachelors in Computer Science or Electrical Engineering or related fie... computer science, asr, linux, transcription, enterprise applications, machine learning, agile, information retrieval",[],8,"['computer science', 'asr', 'linux', 'transcription', 'enterprise applications', 'machine learning', 'agile', 'information retrieval']","computer science, asr, linux, transcription, enterprise applications, machine learning, agile, information retrieval"
Machine Learning Engineer,SAP,ML Engineer,Bengaluru,On-site,3-7 Yrs,3,7,5.0,Not disclosed,Please note that any violation of these guidelines may result in disqualification from ...,"kubernetes, application software, python, orchestration, software design, golang, microsoft azure, distribution system",https://www.naukri.com/job-listings-machine-learning-engineer-sap-india-pvt-ltd-bengaluru-3-to-7-years-200126506754,"Please note that any violation of these guidelines may result in disqualification from ... kubernetes, application software, python, orchestration, software design, golang, microsoft azure, distribution system",[],8,"['kubernetes', 'application software', 'python', 'orchestration', 'software design', 'golang', 'microsoft azure', 'distribution system']","kubernetes, application software, python, orchestration, software design, golang, microsoft azure, distribution system"
Machine Learning Engineer,Tata Consultancy Services,ML Engineer,Hyderabad,On-site,4-8 Yrs,4,8,6.0,Not disclosed,Participate in requirement analysis and solution design .,"data modeling, machine learning, python, machine, data, modeling",https://www.naukri.com/job-listings-machine-learning-engineer-tata-consultancy-services-hyderabad-chennai-4-to-8-years-100226019388,"Participate in requirement analysis and solution design . data modeling, machine learning, python, machine, data, modeling",[],6,"['data modeling', 'machine learning', 'python', 'machine', 'data', 'modeling']","data modeling, machine learning, python, machine, data, modeling"
AI and Machine Learning Engineer,Hewlett Packard Enterprise,ML Engineer,Bengaluru,On-site,4-7 Yrs,4,7,5.5,Not disclosed,". Education and Experience Required: . Bachelors degree in computer science, engineerin...","tcp, computer science, git, claims, development manager, design review, machine learning, business intelligence",https://www.naukri.com/job-listings-ai-and-machine-learning-engineer-hewlett-packard-enterprise-bengaluru-4-to-7-years-230126502661,". Education and Experience Required: . Bachelors degree in computer science, engineerin... tcp, computer science, git, claims, development manager, design review, machine learning, business intelligence",[],8,"['tcp', 'computer science', 'git', 'claims', 'development manager', 'design review', 'machine learning', 'business intelligence']","tcp, computer science, git, claims, development manager, design review, machine learning, business intelligence"
Machine Learning Engineer - Gen AI,Inumellas Consultancy Services,ML Engineer,Hyderabad,Hybrid,6-10 Yrs,6,10,8.0,30-40 Lacs PA,"- Bachelors or Masters degree in Computer Science, Engineering, or a related fieldPosit...","tensorflow, natural language processing, pytorch, large language model, computer vision, tool calling patterns, vertex, crewai",https://www.naukri.com/job-listings-machine-learning-engineer-gen-ai-inumellas-consultancy-services-hyderabad-pune-bengaluru-6-to-10-years-051225023154,"- Bachelors or Masters degree in Computer Science, Engineering, or a related fieldPosit... tensorflow, natural language processing, pytorch, large language model, computer vision, tool calling patterns, vertex, crewai",[],8,"['tensorflow', 'natural language processing', 'pytorch', 'large language model', 'computer vision', 'tool calling patterns', 'vertex', 'crewai']","tensorflow, natural language processing, pytorch, large language model, computer vision, tool calling patterns, vertex, crewai"
Machine Learning Engineer,Alstom,ML Engineer,Bengaluru,On-site,4-8 Yrs,4,8,6.0,Not disclosed,"Well look to you for:Develop, deploy, and maintain Machine Learning models and retraini...","machine learning, kubernetes, numpy, sql, docker, ansible, tensorflow, git",https://www.naukri.com/job-listings-machine-learning-engineer-alstom-transport-india-ltd-bengaluru-4-to-8-years-230126908634,"Well look to you for:Develop, deploy, and maintain Machine Learning models and retraini... machine learning, kubernetes, numpy, sql, docker, ansible, tensorflow, git",[],8,"['machine learning', 'kubernetes', 'numpy', 'sql', 'docker', 'ansible', 'tensorflow', 'git']","machine learning, kubernetes, numpy, sql, docker, ansible, tensorflow, git"
Machine Learn Engineer,Silicon Image India Research Development,ML Engineer,Pune,On-site,15-20 Yrs,15,20,17.5,Not disclosed,Required Skills and Qualifications Exceptional ability to influence senior stakeholders...,"semiconductor, neural networks, product innovation, intellectual property, deployment, hardware, customer service, manufacturing operations",https://www.naukri.com/job-listings-machine-learn-engineer-silicon-image-india-research-development-pvt-ltd-pune-15-to-20-years-200226500390,"Required Skills and Qualifications Exceptional ability to influence senior stakeholders... semiconductor, neural networks, product innovation, intellectual property, deployment, hardware, customer service, manufacturing operations",[],8,"['semiconductor', 'neural networks', 'product innovation', 'intellectual property', 'deployment', 'hardware', 'customer service', 'manufacturing operations']","semiconductor, neural networks, product innovation, intellectual property, deployment, hardware, customer service, manufacturing operations"
Principal Machine Learning Engineer,Red Hat,ML Engineer,Bengaluru,On-site,5-10 Yrs,5,10,7.5,Not disclosed,"This includes working knowledge of TensorFlow, TensorFlow Serving, Keras, and PyTorch, ...","machine learning, sales, microservices, alerting, tensorflow, spacy, java, data science",https://www.naukri.com/job-listings-principal-machine-learning-engineer-red-hat-india-pvt-ltd-bengaluru-5-to-10-years-220126938970,"This includes working knowledge of TensorFlow, TensorFlow Serving, Keras, and PyTorch, ... machine learning, sales, microservices, alerting, tensorflow, spacy, java, data science",[],8,"['machine learning', 'sales', 'microservices', 'alerting', 'tensorflow', 'spacy', 'java', 'data science']","machine learning, sales, microservices, alerting, tensorflow, spacy, java, data science"
Machine Learning Engineer 4,Adobe,ML Engineer,Noida,On-site,7-12 Yrs,7,12,9.5,Not disclosed,"Build experiments, algorithms and prototypes that not only yield high accuracy but are ...","computer science, computer vision, deep learning, c++, image processing, content analysis, machine learning, data structures",https://www.naukri.com/job-listings-machine-learning-engineer-4-adobe-systems-india-pvt-ltd-noida-7-to-12-years-090226503713,"Build experiments, algorithms and prototypes that not only yield high accuracy but are ... computer science, computer vision, deep learning, c++, image processing, content analysis, machine learning, data structures",[],8,"['computer science', 'computer vision', 'deep learning', 'c++', 'image processing', 'content analysis', 'machine learning', 'data structures']","computer science, computer vision, deep learning, c++, image processing, content analysis, machine learning, data structures"
Machine Learn Engineer 4,Silicon Image India Research Development,ML Engineer,Pune,On-site,7-12 Yrs,7,12,9.5,Not disclosed,"Required Skills and Qualifications Outstanding mentorship, communication, and cross-fun...","semiconductor, fpga, product innovation, focus, intellectual property, debugging, hardware, customer service",https://www.naukri.com/job-listings-machine-learn-engineer-4-silicon-image-india-research-development-pvt-ltd-pune-7-to-12-years-210226500062,"Required Skills and Qualifications Outstanding mentorship, communication, and cross-fun... semiconductor, fpga, product innovation, focus, intellectual property, debugging, hardware, customer service",[],8,"['semiconductor', 'fpga', 'product innovation', 'focus', 'intellectual property', 'debugging', 'hardware', 'customer service']","semiconductor, fpga, product innovation, focus, intellectual property, debugging, hardware, customer service"
Machine Learning Engineer,Aidaptive,ML Engineer,Kolkata,On-site,2-5 Yrs,2,5,3.5,Not disclosed,"Minimum qualifications: . Bachelors degree in Computer Science, Mathematics, or equival...","computer science, computer vision, deep learning, artificial intelligence, machine learning, deployment, natural language processing, management",https://www.naukri.com/job-listings-machine-learning-engineer-aidaptive-kolkata-mumbai-new-delhi-hyderabad-pune-chennai-bengaluru-2-to-5-years-090224500861,"Minimum qualifications: . Bachelors degree in Computer Science, Mathematics, or equival... computer science, computer vision, deep learning, artificial intelligence, machine learning, deployment, natural language processing, management",[],8,"['computer science', 'computer vision', 'deep learning', 'artificial intelligence', 'machine learning', 'deployment', 'natural language processing', 'management']","computer science, computer vision, deep learning, artificial intelligence, machine learning, deployment, natural language processing, management"
Machine Learning Engineer,Sarvam,ML Engineer,Bengaluru,On-site,3-6 Yrs,3,6,4.5,Not disclosed,"We are building a scalable, AI-powered dubbing platform used across multiple languages...","performance tuning, automation, product engineering, machine learning, debugging, continuous improvement, operations, distribution system",https://www.naukri.com/job-listings-machine-learning-engineer-sarvam-bengaluru-3-to-6-years-170226504514,"We are building a scalable, AI-powered dubbing platform used across multiple languages... performance tuning, automation, product engineering, machine learning, debugging, continuous improvement, operations, distribution system",[],8,"['performance tuning', 'automation', 'product engineering', 'machine learning', 'debugging', 'continuous improvement', 'operations', 'distribution system']","performance tuning, automation, product engineering, machine learning, debugging, continuous improvement, operations, distribution system"
Staff Machine Learning Engineer,Automation Anywhere,ML Engineer,Bengaluru,On-site,6-11 Yrs,6,11,8.5,Not disclosed,"Bachelor s or master s degree in computer science, Data Science, or related fieldsBasic...","process automation, training, computer vision, machine learning, data collection, data processing, analytics, sql",https://www.naukri.com/job-listings-staff-machine-learning-engineer-automation-anywhere-software-pvt-ltd-bengaluru-6-to-11-years-190226505243,"Bachelor s or master s degree in computer science, Data Science, or related fieldsBasic... process automation, training, computer vision, machine learning, data collection, data processing, analytics, sql",[],8,"['process automation', 'training', 'computer vision', 'machine learning', 'data collection', 'data processing', 'analytics', 'sql']","process automation, training, computer vision, machine learning, data collection, data processing, analytics, sql"
Machine Learning Engineer Masters (Intern)-Splunk / UHR,Cisco,ML Engineer,Hyderabad,On-site,0-1 Yrs,0,1,0.5,Not disclosed,"Minimum Qualifications Preferred Qualifications Programming experience with Java, C++, ...","machine learning, deep learning, python, java, software development, natural language processing, computer vision, ai",https://www.naukri.com/job-listings-machine-learning-engineer-masters-intern-splunk-uhr-cisco-systems-india-private-limited-hyderabad-0-to-1-years-280126927498,"Minimum Qualifications Preferred Qualifications Programming experience with Java, C++, ... machine learning, deep learning, python, java, software development, natural language processing, computer vision, ai",[],8,"['machine learning', 'deep learning', 'python', 'java', 'software development', 'natural language processing', 'computer vision', 'ai']","machine learning, deep learning, python, java, software development, natural language processing, computer vision, ai"
Machine Learning Engineer,3Shool Technology Consultants,ML Engineer,Remote,Remote,6-10 Yrs,6,10,8.0,Not disclosed,"Mandatory Skills: - Python and SQL - Exposure to GenAI, LLMOps, and MLOps (AWS) Note: C...","genai, llm, machine learning, python, ml, gen ai, generative ai, aws",https://www.naukri.com/job-listings-machine-learning-engineer-3shool-technology-consultants-chennai-6-to-10-years-160226037120,"Mandatory Skills: - Python and SQL - Exposure to GenAI, LLMOps, and MLOps (AWS) Note: C... genai, llm, machine learning, python, ml, gen ai, generative ai, aws",[],8,"['genai', 'llm', 'machine learning', 'python', 'ml', 'gen ai', 'generative ai', 'aws']","genai, llm, machine learning, python, ml, gen ai, generative ai, aws"
Machine Learning Engineer - Application AI,SAP,ML Engineer,Bengaluru,On-site,4-7 Yrs,4,7,5.5,Not disclosed,Preferred: . Internship or project experience with AI / ML or LLM frameworks . .,"software design, backend, sap, machine learning, system design, internship, distribution system, analytics",https://www.naukri.com/job-listings-machine-learning-engineer-application-ai-sap-india-pvt-ltd-bengaluru-4-to-7-years-061125505979,"Preferred: . Internship or project experience with AI / ML or LLM frameworks . . software design, backend, sap, machine learning, system design, internship, distribution system, analytics",[],8,"['software design', 'backend', 'sap', 'machine learning', 'system design', 'internship', 'distribution system', 'analytics']","software design, backend, sap, machine learning, system design, internship, distribution system, analytics"
Machine Learning Engineer Application AI,SAP,ML Engineer,Bengaluru,On-site,3-7 Yrs,3,7,5.0,Not disclosed,"Experience with machine learning frameworks such as TensorFlow, PyTorch, or scikit-learn","python, java, golang, ci/cd, software engineering, api, artificial intelligence, communication skills",https://www.naukri.com/job-listings-machine-learning-engineer-application-ai-sap-india-pvt-ltd-bengaluru-3-to-7-years-091225500722,"Experience with machine learning frameworks such as TensorFlow, PyTorch, or scikit-learn python, java, golang, ci/cd, software engineering, api, artificial intelligence, communication skills",[],8,"['python', 'java', 'golang', 'ci/cd', 'software engineering', 'api', 'artificial intelligence', 'communication skills']","python, java, golang, ci/cd, software engineering, api, artificial intelligence, communication skills"
Engineer- Machine Learning,Edge Executive Search,ML Engineer,Gurugram,On-site,1-5 Yrs,1,5,3.0,Not disclosed,"Bachelors degree in computer Science, Data Science, Generative AI, Engineering or ...","computer science, c++, automation, aviation, data science, machine learning, cloud, natural language processing",https://www.naukri.com/job-listings-engineer-machine-learning-edge-executive-search-pvt-ltd-gurugram-1-to-5-years-210226500398,"Bachelors degree in computer Science, Data Science, Generative AI, Engineering or ... computer science, c++, automation, aviation, data science, machine learning, cloud, natural language processing",[],8,"['computer science', 'c++', 'automation', 'aviation', 'data science', 'machine learning', 'cloud', 'natural language processing']","computer science, c++, automation, aviation, data science, machine learning, cloud, natural language processing"
Machine Learning Engineer,Applied Data Finance,ML Engineer,Hyderabad,On-site,1-3 Yrs,1,3,2.0,Not disclosed,"Proficient in SQL and working with structured data from sources like Redshift, RDS, etc...","machine learning, python, amazon redshift, ci/cd, python programming, sql, machine, programming",https://www.naukri.com/job-listings-machine-learning-engineer-applied-data-finance-hyderabad-chennai-bengaluru-1-to-3-years-110226930068,"Proficient in SQL and working with structured data from sources like Redshift, RDS, etc... machine learning, python, amazon redshift, ci/cd, python programming, sql, machine, programming",[],8,"['machine learning', 'python', 'amazon redshift', 'ci/cd', 'python programming', 'sql', 'machine', 'programming']","machine learning, python, amazon redshift, ci/cd, python programming, sql, machine, programming"
AI/Machine Learning Engineer,Assetone,ML Engineer,Pune,On-site,2-6 Yrs,2,6,4.0,Not disclosed,Developer  Job Type : Full Time  Job Location : Pune  Exp : 2 to 6 years  Seeking an AI...,"analytical skills, computer vision, deep learning, 3d modeling, image processing, analytical, machine learning, algorithm development",https://www.naukri.com/job-listings-ai-machine-learning-engineer-assetone-pune-2-to-6-years-300126501695,"Developer  Job Type : Full Time  Job Location : Pune  Exp : 2 to 6 years  Seeking an AI... analytical skills, computer vision, deep learning, 3d modeling, image processing, analytical, machine learning, algorithm development",[],8,"['analytical skills', 'computer vision', 'deep learning', '3d modeling', 'image processing', 'analytical', 'machine learning', 'algorithm development']","analytical skills, computer vision, deep learning, 3d modeling, image processing, analytical, machine learning, algorithm development"
Machine Learning Engineer,Parishram Resources I Pvt. Ltd.,ML Engineer,Mumbai (All Areas),Hybrid,3-5 Yrs,3,5,4.0,3-6 Lacs PA,Must Have Skills Experience with production ML systems Good to Have,"natural language processing, fast api, cloud platform, machine learning, python, processing, languages, machine",https://www.naukri.com/job-listings-machine-learning-engineer-parishram-resources-mumbai-all-areas-3-to-5-years-180226028269,"Must Have Skills Experience with production ML systems Good to Have natural language processing, fast api, cloud platform, machine learning, python, processing, languages, machine",[],8,"['natural language processing', 'fast api', 'cloud platform', 'machine learning', 'python', 'processing', 'languages', 'machine']","natural language processing, fast api, cloud platform, machine learning, python, processing, languages, machine"
Machine Learning Engineer,Epsilon Data Management,ML Engineer,Bengaluru,On-site,3-8 Yrs,3,8,5.5,Not disclosed,He /she should be able to communicate findings and the way techniques work in a manner ...,"unix, computer science, automation, linux, data management, data modeling, machine learning, analytics",https://www.naukri.com/job-listings-machine-learning-engineer-epsilon-asia-group-of-companies-bengaluru-3-to-8-years-100226504019,"He /she should be able to communicate findings and the way techniques work in a manner ... unix, computer science, automation, linux, data management, data modeling, machine learning, analytics",[],8,"['unix', 'computer science', 'automation', 'linux', 'data management', 'data modeling', 'machine learning', 'analytics']","unix, computer science, automation, linux, data management, data modeling, machine learning, analytics"
Machine Learning Engineer,Leading Global IT Service and Consulting Organisation,ML Engineer,Bengaluru,On-site,6-10 Yrs,6,10,8.0,Not disclosed,Years of Experience: 6.0-10.0 YearsJob Title: Machine Learning Engineer (Python Coding...,"mlops, machine learning algorithms, machine learning, python, data modeling, ml algorithms, sql, machine",https://www.naukri.com/job-listings-machine-learning-engineer-anlage-infotech-bengaluru-6-to-10-years-251125028466,"Years of Experience: 6.0-10.0 YearsJob Title: Machine Learning Engineer (Python Coding... mlops, machine learning algorithms, machine learning, python, data modeling, ml algorithms, sql, machine",[],8,"['mlops', 'machine learning algorithms', 'machine learning', 'python', 'data modeling', 'ml algorithms', 'sql', 'machine']","mlops, machine learning algorithms, machine learning, python, data modeling, ml algorithms, sql, machine"
