title,company,role,city,work_mode,experience,exp_min,exp_max,exp_avg,salary,description,skills,url,combined_text,extracted_skills,skill_count,skills_list,extracted_skills_str
EY India is hiring Data Analyst For Forensics Team,EY,Data Analyst,Gurugram,On-site,2-5 Yrs,2,5,3.5,7-11 Lacs PA,Good to have: . Machine Learning,"data analytics, t-sql/python, power bi, data analyst, data analysis, data visualization, tableau, ssis",https://www.naukri.com/job-listings-ey-india-is-hiring-data-analyst-for-forensics-team-ey-gurugram-2-to-5-years-180226025679,"Good to have: . Machine Learning data analytics, t-sql/python, power bi, data analyst, data analysis, data visualization, tableau, ssis",[],8,"['data analytics', 't-sql/python', 'power bi', 'data analyst', 'data analysis', 'data visualization', 'tableau', 'ssis']","data analytics, t-sql/python, power bi, data analyst, data analysis, data visualization, tableau, ssis"
Data Analyst,Barclays,Data Analyst,Gurugram,On-site,0-5 Yrs,0,5,2.5,Not disclosed,Graduation as a minimum. They will identify new directions for assignments and/ or proj...,"sas, project management, analytical, machine learning, agile, workflow, business strategy, assistant vice president",https://www.naukri.com/job-listings-data-analyst-barclays-shared-services-gurugram-0-to-5-years-210226500086,"Graduation as a minimum. They will identify new directions for assignments and/ or proj... sas, project management, analytical, machine learning, agile, workflow, business strategy, assistant vice president",[],8,"['sas', 'project management', 'analytical', 'machine learning', 'agile', 'workflow', 'business strategy', 'assistant vice president']","sas, project management, analytical, machine learning, agile, workflow, business strategy, assistant vice president"
Data Analyst,Capgemini,Data Analyst,Bengaluru,On-site,2-5 Yrs,2,5,3.5,Not disclosed,Develop or enhance data pipelines to extract and process required data efficiently. The...,"data analyst, data analytics, data analysis, software development, data pipelines, microsoft azure, power bi, sql",https://www.naukri.com/job-listings-data-analyst-capgemini-technology-services-india-limited-bengaluru-2-to-5-years-170226919510,"Develop or enhance data pipelines to extract and process required data efficiently. The... data analyst, data analytics, data analysis, software development, data pipelines, microsoft azure, power bi, sql",[],8,"['data analyst', 'data analytics', 'data analysis', 'software development', 'data pipelines', 'microsoft azure', 'power bi', 'sql']","data analyst, data analytics, data analysis, software development, data pipelines, microsoft azure, power bi, sql"
Data Analyst,Swiggy,Data Analyst,Bengaluru,On-site,1-6 Yrs,1,6,3.5,3.25-5 Lacs PA,Qualifications and Skills: . Bachelors or Masters Degree in any disciplineThe ideal can...,"e-commerce, advance sql, data analytics, power bi, advanced excel, sql, data, data analysis",https://www.naukri.com/job-listings-data-analyst-swiggy-bengaluru-1-to-6-years-190226014074,"Qualifications and Skills: . Bachelors or Masters Degree in any disciplineThe ideal can... e-commerce, advance sql, data analytics, power bi, advanced excel, sql, data, data analysis",[],8,"['e-commerce', 'advance sql', 'data analytics', 'power bi', 'advanced excel', 'sql', 'data', 'data analysis']","e-commerce, advance sql, data analytics, power bi, advanced excel, sql, data, data analysis"
Data Analyst,Barclays,Data Analyst,Pune,On-site,0-7 Yrs,0,7,3.5,Not disclosed,"They will identify new directions for assignments and/ or projects, identifying a combi...","advanced analytics, analytical, machine learning, service excellence, data analyst, business strategy, assistant vice president, individual contributor",https://www.naukri.com/job-listings-data-analyst-barclays-shared-services-pune-0-to-7-years-170226501170,"They will identify new directions for assignments and/ or projects, identifying a combi... advanced analytics, analytical, machine learning, service excellence, data analyst, business strategy, assistant vice president, individual contributor",[],8,"['advanced analytics', 'analytical', 'machine learning', 'service excellence', 'data analyst', 'business strategy', 'assistant vice president', 'individual contributor']","advanced analytics, analytical, machine learning, service excellence, data analyst, business strategy, assistant vice president, individual contributor"
Data Analyst,Barclays,Data Analyst,Pune,On-site,0-7 Yrs,0,7,3.5,Not disclosed,Requires in-depth technical knowledge and experience in their assigned area of expertis...,"unix, data analysis, iso, senior analyst, rdbms, analytical, continuous improvement, operations",https://www.naukri.com/job-listings-data-analyst-barclays-shared-services-pune-0-to-7-years-160226501534,"Requires in-depth technical knowledge and experience in their assigned area of expertis... unix, data analysis, iso, senior analyst, rdbms, analytical, continuous improvement, operations",[],8,"['unix', 'data analysis', 'iso', 'senior analyst', 'rdbms', 'analytical', 'continuous improvement', 'operations']","unix, data analysis, iso, senior analyst, rdbms, analytical, continuous improvement, operations"
Data Analyst,Cognizant,Data Analyst,Hyderabad,On-site,5-8 Yrs,5,8,6.5,Not disclosed,". 6+. years of experience in Data Analytics, with a focus on analyzing large data sets ...","charts, data validation, vlookup, dashboards, sales, sql, spreadsheets, salesforce",https://www.naukri.com/job-listings-data-analyst-cognizant-hyderabad-5-to-8-years-180226021106,". 6+. years of experience in Data Analytics, with a focus on analyzing large data sets ... charts, data validation, vlookup, dashboards, sales, sql, spreadsheets, salesforce",[],8,"['charts', 'data validation', 'vlookup', 'dashboards', 'sales', 'sql', 'spreadsheets', 'salesforce']","charts, data validation, vlookup, dashboards, sales, sql, spreadsheets, salesforce"
Data Analyst,Secure Meters,Data Analyst,Ranchi,On-site,0-2 Yrs,0,2,1.0,Not disclosed,Qualification: . An ideal candidate is someone from an electrical or electronics backgr...,"data analysis, data visualization, energy audit, sql queries, advanced excel, data analytics, sql, auditing",https://www.naukri.com/job-listings-data-analyst-secure-meters-ranchi-0-to-2-years-250425018782,"Qualification: . An ideal candidate is someone from an electrical or electronics backgr... data analysis, data visualization, energy audit, sql queries, advanced excel, data analytics, sql, auditing",[],8,"['data analysis', 'data visualization', 'energy audit', 'sql queries', 'advanced excel', 'data analytics', 'sql', 'auditing']","data analysis, data visualization, energy audit, sql queries, advanced excel, data analytics, sql, auditing"
Online Data Analyst -Gujarati,TELUS Digital,Data Analyst,Remote,Remote,0-3 Yrs,0,3,1.5,Not disclosed,Job Type: Freelance  Educational Qualification : Graduate /Masters,"language skills, gujarati, speaking skills, languages, data analysis, data",https://www.naukri.com/job-listings-online-data-analyst-telus-digital-bengaluru-0-to-3-years-160226004708,"Job Type: Freelance  Educational Qualification : Graduate /Masters language skills, gujarati, speaking skills, languages, data analysis, data",[],6,"['language skills', 'gujarati', 'speaking skills', 'languages', 'data analysis', 'data']","language skills, gujarati, speaking skills, languages, data analysis, data"
Online Data Analyst-Punjabi,TELUS Digital,Data Analyst,Remote,Remote,0-2 Yrs,0,2,1.0,Not disclosed,Job Type: Freelance  Educational Qualification : Graduate /Masters,"google maps, mapserver, punjabi, punjab, navigation, languages, data analytics, analytics",https://www.naukri.com/job-listings-online-data-analyst-punjabi-telus-digital-bengaluru-0-to-2-years-110226018805,"Job Type: Freelance  Educational Qualification : Graduate /Masters google maps, mapserver, punjabi, punjab, navigation, languages, data analytics, analytics",[],8,"['google maps', 'mapserver', 'punjabi', 'punjab', 'navigation', 'languages', 'data analytics', 'analytics']","google maps, mapserver, punjabi, punjab, navigation, languages, data analytics, analytics"
Data Analyst,Virtusa,Data Analyst,Bengaluru,On-site,5-10 Yrs,5,10,7.5,Not disclosed,Skills required: . Data viz: Tableau / PowerBI / any others  Good to have: . Exposure t...,"data analyst, python, tableau, data extraction, data analytics, analytical skills, sql, data",https://www.naukri.com/job-listings-data-analyst-virtusa-consulting-services-pvt-ltd-bengaluru-5-to-10-years-180226925407,"Skills required: . Data viz: Tableau / PowerBI / any others  Good to have: . Exposure t... data analyst, python, tableau, data extraction, data analytics, analytical skills, sql, data",[],8,"['data analyst', 'python', 'tableau', 'data extraction', 'data analytics', 'analytical skills', 'sql', 'data']","data analyst, python, tableau, data extraction, data analytics, analytical skills, sql, data"
GTM Data Analyst,Cognizant,Data Analyst,Hyderabad,On-site,8-12 Yrs,8,12,10.0,Not disclosed,read only data access only. Manual Process Work  . 6 Years of experience in Data Analyt...,"advance sql, python, conditional formatting, charts, data analytics, data analysis, indexing, data validation",https://www.naukri.com/job-listings-gtm-data-analyst-cognizant-hyderabad-8-to-12-years-180226021105,"read only data access only. Manual Process Work  . 6 Years of experience in Data Analyt... advance sql, python, conditional formatting, charts, data analytics, data analysis, indexing, data validation",[],8,"['advance sql', 'python', 'conditional formatting', 'charts', 'data analytics', 'data analysis', 'indexing', 'data validation']","advance sql, python, conditional formatting, charts, data analytics, data analysis, indexing, data validation"
Online Data Analyst - Kannada,TELUS Digital,Data Analyst,Remote,Remote,0-2 Yrs,0,2,1.0,Not disclosed,This is a part-time long-term project and your work will be subject to our standard qua...,"data analysis, mapping, online data analysis, quality assurance, ai models, machine learning, assurance, data",https://www.naukri.com/job-listings-online-data-analyst-kannada-telus-digital-bengaluru-0-to-2-years-040325916691,"This is a part-time long-term project and your work will be subject to our standard qua... data analysis, mapping, online data analysis, quality assurance, ai models, machine learning, assurance, data",[],8,"['data analysis', 'mapping', 'online data analysis', 'quality assurance', 'ai models', 'machine learning', 'assurance', 'data']","data analysis, mapping, online data analysis, quality assurance, ai models, machine learning, assurance, data"
Data Analyst,Capgemini,Data Analyst,Chennai,Hybrid,4-9 Yrs,4,9,6.5,Not disclosed,"Required Skills & Qualifications: . Bachelors degree in Data Science, Statistics, Compu...","power bi, data analysis, data visualization, tableau, data analytics, sql, analysis, bi",https://www.naukri.com/job-listings-data-analyst-capgemini-chennai-delhi-ncr-mumbai-all-areas-4-to-9-years-021225014173,"Required Skills & Qualifications: . Bachelors degree in Data Science, Statistics, Compu... power bi, data analysis, data visualization, tableau, data analytics, sql, analysis, bi",[],8,"['power bi', 'data analysis', 'data visualization', 'tableau', 'data analytics', 'sql', 'analysis', 'bi']","power bi, data analysis, data visualization, tableau, data analytics, sql, analysis, bi"
Data Analyst,FedEx,Data Analyst,Bengaluru,Hybrid,3-5 Yrs,3,5,4.0,Not disclosed,"Role & responsibilities  Python: Proficiency in data manipulation, data analysis librar...","power bi, data analytics, python, sql, stakeholder management, data, data analysis, bi",https://www.naukri.com/job-listings-data-analyst-fedex-bengaluru-3-to-5-years-170226047162,"Role & responsibilities  Python: Proficiency in data manipulation, data analysis librar... power bi, data analytics, python, sql, stakeholder management, data, data analysis, bi",[],8,"['power bi', 'data analytics', 'python', 'sql', 'stakeholder management', 'data', 'data analysis', 'bi']","power bi, data analytics, python, sql, stakeholder management, data, data analysis, bi"
Data Analyst,V5 Global,Data Analyst,Bengaluru,On-site,1-6 Yrs,1,6,3.5,3.5-5 Lacs PA,Required Skill: . Must have Excel Advance & Power BIMust have knowledge / execution eff...,"data analysis, advanced ms excel, python, data analytics, analysis, analytics, data, microsoft",https://www.naukri.com/job-listings-data-analyst-firstmeridian-global-services-bengaluru-1-to-6-years-180226034917,"Required Skill: . Must have Excel Advance & Power BIMust have knowledge / execution eff... data analysis, advanced ms excel, python, data analytics, analysis, analytics, data, microsoft",[],8,"['data analysis', 'advanced ms excel', 'python', 'data analytics', 'analysis', 'analytics', 'data', 'microsoft']","data analysis, advanced ms excel, python, data analytics, analysis, analytics, data, microsoft"
Data Analyst,Wynploy,Data Analyst,Pune,On-site,1-3 Yrs,1,3,2.0,Not disclosed,"[{""Salary"":null , ""Remote_Job"":false , ""Posting_Title"":""Data Analyst"" , ""Is_Locked"":fal...","data analyst, data visualization, sql, python, data, data analysis",https://www.naukri.com/job-listings-data-analyst-wynploy-pune-1-to-3-years-200226505644,"[{""Salary"":null , ""Remote_Job"":false , ""Posting_Title"":""Data Analyst"" , ""Is_Locked"":fal... data analyst, data visualization, sql, python, data, data analysis",[],6,"['data analyst', 'data visualization', 'sql', 'python', 'data', 'data analysis']","data analyst, data visualization, sql, python, data, data analysis"
Data Analyst,Barclays,Data Analyst,Gurugram,On-site,0-7 Yrs,0,7,3.5,Not disclosed,Graduation as a minimum. They will identify new directions for assignments and/ or proj...,"sas, project management, analytical, machine learning, agile, business strategy, assistant vice president, microsoft",https://www.naukri.com/job-listings-data-analyst-barclays-shared-services-gurugram-0-to-7-years-190226501381,"Graduation as a minimum. They will identify new directions for assignments and/ or proj... sas, project management, analytical, machine learning, agile, business strategy, assistant vice president, microsoft",[],8,"['sas', 'project management', 'analytical', 'machine learning', 'agile', 'business strategy', 'assistant vice president', 'microsoft']","sas, project management, analytical, machine learning, agile, business strategy, assistant vice president, microsoft"
Data Analyst,FedEx,Data Analyst,Bengaluru,On-site,2-4 Yrs,2,4,3.0,Not disclosed,"The Analyst will collaborate with global stakeholders to execute, validate, audit, and ...","process automation, sas, mis, data quality, business solutions, stakeholder management, continuous improvement, analytics",https://www.naukri.com/job-listings-data-analyst-fedex-express-bengaluru-2-to-4-years-210226501356,"The Analyst will collaborate with global stakeholders to execute, validate, audit, and ... process automation, sas, mis, data quality, business solutions, stakeholder management, continuous improvement, analytics",[],8,"['process automation', 'sas', 'mis', 'data quality', 'business solutions', 'stakeholder management', 'continuous improvement', 'analytics']","process automation, sas, mis, data quality, business solutions, stakeholder management, continuous improvement, analytics"
Prices Data Analyst,Argus India Price Reporting Services,Data Analyst,Mumbai,On-site,0-2 Yrs,0,2,1.0,Not disclosed,"Has the ability to work independently, make recommendations, influence decisions and gu...","data operations, metadata, project management, oracle, data analysis, business requirements, data validation, mathematics",https://www.naukri.com/job-listings-prices-data-analyst-argus-media-mumbai-0-to-2-years-160226501385,"Has the ability to work independently, make recommendations, influence decisions and gu... data operations, metadata, project management, oracle, data analysis, business requirements, data validation, mathematics",[],8,"['data operations', 'metadata', 'project management', 'oracle', 'data analysis', 'business requirements', 'data validation', 'mathematics']","data operations, metadata, project management, oracle, data analysis, business requirements, data validation, mathematics"
Prices Data Analyst,Argus India Price Reporting Services,Data Analyst,Mumbai,On-site,0-2 Yrs,0,2,1.0,Not disclosed,"Has the ability to work independently, make recommendations, influence decisions and gu...","metadata, project management, oracle, data analysis, business requirements, data validation, mathematics, power bi",https://www.naukri.com/job-listings-prices-data-analyst-argus-media-mumbai-0-to-2-years-160226501386,"Has the ability to work independently, make recommendations, influence decisions and gu... metadata, project management, oracle, data analysis, business requirements, data validation, mathematics, power bi",[],8,"['metadata', 'project management', 'oracle', 'data analysis', 'business requirements', 'data validation', 'mathematics', 'power bi']","metadata, project management, oracle, data analysis, business requirements, data validation, mathematics, power bi"
Data Analyst,Dexian India Technologies,Data Analyst,Bengaluru(Silk Board),On-site,0-1 Yrs,0,1,0.5,Not disclosed,"Perform analysis of wind turbine image data. Assist in identifying, comparing, and ann...","data analysis, communication skills, data validation, problem solving, wind energy, data collection, defect identification, renewable energy",https://www.naukri.com/job-listings-data-analyst-dexian-india-technologies-bengaluru-0-to-1-years-180226017779,"Perform analysis of wind turbine image data. Assist in identifying, comparing, and ann... data analysis, communication skills, data validation, problem solving, wind energy, data collection, defect identification, renewable energy",[],8,"['data analysis', 'communication skills', 'data validation', 'problem solving', 'wind energy', 'data collection', 'defect identification', 'renewable energy']","data analysis, communication skills, data validation, problem solving, wind energy, data collection, defect identification, renewable energy"
Data Analyst,THE Talent Keepers,Data Analyst,Noida,On-site,0-3 Yrs,0,3,1.5,Not disclosed,1 3 years of relevant experience as a Business Analyst or in a similar analytical role ...,"data analysis, excel, project management, process improvement, analytical, agile, power bi, jira",https://www.naukri.com/job-listings-data-analyst-the-talent-keepers-noida-0-to-3-years-190226501475,"1 3 years of relevant experience as a Business Analyst or in a similar analytical role ... data analysis, excel, project management, process improvement, analytical, agile, power bi, jira",[],8,"['data analysis', 'excel', 'project management', 'process improvement', 'analytical', 'agile', 'power bi', 'jira']","data analysis, excel, project management, process improvement, analytical, agile, power bi, jira"
Data Analyst,Transunion,Data Analyst,Hyderabad,On-site,0-5 Yrs,0,5,2.5,Not disclosed,This role is essential to keep the lights on for core reporting and monitoring activiti...,"quality monitoring, data analysis, data services, focus, data quality, data integrity, data analyst, business continuity",https://www.naukri.com/job-listings-data-analyst-transunion-hyderabad-0-to-5-years-170226501964,"This role is essential to keep the lights on for core reporting and monitoring activiti... quality monitoring, data analysis, data services, focus, data quality, data integrity, data analyst, business continuity",[],8,"['quality monitoring', 'data analysis', 'data services', 'focus', 'data quality', 'data integrity', 'data analyst', 'business continuity']","quality monitoring, data analysis, data services, focus, data quality, data integrity, data analyst, business continuity"
Data Analyst,Viaprom Technologies,Data Analyst,Bengaluru,On-site,2-5 Yrs,2,5,3.5,Not disclosed,Role Overview: We at VIAPROM are seeking a skilled Data Analyst with 2-5 years of exper...,"data analyst, analytics, python, data analytics, data analysis, automation, data validation, data processing",https://www.naukri.com/job-listings-data-analyst-viaprom-technologies-pvt-ltd-bengaluru-2-to-5-years-160226920084,"Role Overview: We at VIAPROM are seeking a skilled Data Analyst with 2-5 years of exper... data analyst, analytics, python, data analytics, data analysis, automation, data validation, data processing",[],8,"['data analyst', 'analytics', 'python', 'data analytics', 'data analysis', 'automation', 'data validation', 'data processing']","data analyst, analytics, python, data analytics, data analysis, automation, data validation, data processing"
Data Analyst,Logic Planet,Data Analyst,Kolkata,On-site,3-6 Yrs,3,6,4.5,Not disclosed,Data Analyst profiles (around 3 years of experience) who have strong experience in Data...,"llm, data analyst, finance, healthcare, data analysis, data",https://www.naukri.com/job-listings-data-analyst-logicplanet-it-services-kolkata-mumbai-new-delhi-hyderabad-pune-chennai-bengaluru-3-to-6-years-200226504752,"Data Analyst profiles (around 3 years of experience) who have strong experience in Data... llm, data analyst, finance, healthcare, data analysis, data",[],6,"['llm', 'data analyst', 'finance', 'healthcare', 'data analysis', 'data']","llm, data analyst, finance, healthcare, data analysis, data"
Data Analyst,BDO India,Data Analyst,Bengaluru,On-site,5-8 Yrs,5,8,6.5,9.5-14 Lacs PA,"1) A bachelors degree in Computer Science, Information Management, Statistics, or a com...","data analytics, r, sas, power bi, data manipulation, data visualization, spss, tableau",https://www.naukri.com/job-listings-data-analyst-bdo-india-bengaluru-5-to-8-years-120226017113,"1) A bachelors degree in Computer Science, Information Management, Statistics, or a com... data analytics, r, sas, power bi, data manipulation, data visualization, spss, tableau",[],7,"['data analytics', 'sas', 'power bi', 'data manipulation', 'data visualization', 'spss', 'tableau']","data analytics, sas, power bi, data manipulation, data visualization, spss, tableau"
Data Analyst,Genpact,Data Analyst,Hyderabad,On-site,5-7 Yrs,5,7,6.0,15-20 Lacs PA,Preferred Qualifications / Skills Performed associative and comparative analysis prefer...,"people analytics, power bi, customer analytics, data analytics, sql, data analysis, analytics, analysis",https://www.naukri.com/job-listings-data-analyst-genpact-hyderabad-5-to-7-years-130126011842,"Preferred Qualifications / Skills Performed associative and comparative analysis prefer... people analytics, power bi, customer analytics, data analytics, sql, data analysis, analytics, analysis",[],8,"['people analytics', 'power bi', 'customer analytics', 'data analytics', 'sql', 'data analysis', 'analytics', 'analysis']","people analytics, power bi, customer analytics, data analytics, sql, data analysis, analytics, analysis"
Data Analyst,Shell Infotech,Data Analyst,Bengaluru,Hybrid,4-6 Yrs,4,6,5.0,Not disclosed,"SQL, CDP (Treasure Data), Python/Dig-Dag and Presto/Sql, data engineering.Knowledge & ...","data analysis, treasure data, cdp, presto, data engineering, dig-dag, sql, analysis",https://www.naukri.com/job-listings-data-analyst-shell-infotech-bengaluru-4-to-6-years-200226025447,"SQL, CDP (Treasure Data), Python/Dig-Dag and Presto/Sql, data engineering.Knowledge & ... data analysis, treasure data, cdp, presto, data engineering, dig-dag, sql, analysis",[],8,"['data analysis', 'treasure data', 'cdp', 'presto', 'data engineering', 'dig-dag', 'sql', 'analysis']","data analysis, treasure data, cdp, presto, data engineering, dig-dag, sql, analysis"
Data Analyst,Anblicks Solutions,Data Analyst,Hyderabad,Hybrid,4-6 Yrs,4,6,5.0,Not disclosed,Role & responsibilities  Key Responsibilities: Ensure successful execution of productio...,"python, dashboard development, sql, data analysis, data analytics, analysis, development, analytics",https://www.naukri.com/job-listings-data-analyst-anblicks-solutions-hyderabad-4-to-6-years-200226009099,"Role & responsibilities  Key Responsibilities: Ensure successful execution of productio... python, dashboard development, sql, data analysis, data analytics, analysis, development, analytics",[],8,"['python', 'dashboard development', 'sql', 'data analysis', 'data analytics', 'analysis', 'development', 'analytics']","python, dashboard development, sql, data analysis, data analytics, analysis, development, analytics"
Data Analyst,Virtusa,Data Analyst,Chennai,On-site,7-10 Yrs,7,10,8.5,Not disclosed,Data Analysis Insights Analyze complex datasets to identify trends patterns and opportu...,"data analyst, azure, power bi, finance, bigquery, tableau, looker, forecasting",https://www.naukri.com/job-listings-data-analyst-virtusa-consulting-services-pvt-ltd-chennai-7-to-10-years-180226936432,"Data Analysis Insights Analyze complex datasets to identify trends patterns and opportu... data analyst, azure, power bi, finance, bigquery, tableau, looker, forecasting",[],8,"['data analyst', 'azure', 'power bi', 'finance', 'bigquery', 'tableau', 'looker', 'forecasting']","data analyst, azure, power bi, finance, bigquery, tableau, looker, forecasting"
