title,company,role,city,work_mode,experience,exp_min,exp_max,exp_avg,salary,description,skills,url,combined_text,extracted_skills,skill_count,skills_list,extracted_skills_str
Data Scientist,Barclays,Data Scientist,Pune,On-site,2-7 Yrs,2,7,4.5,Not disclosed,Knowledge or Experience of Financial Crime Operations domain. Requires in-depth technic...,"data analysis, automation, senior analyst, analytical, machine learning, data quality, continuous improvement, operations",https://www.naukri.com/job-listings-data-scientist-barclays-shared-services-pune-2-to-7-years-200226505030,"Knowledge or Experience of Financial Crime Operations domain. Requires in-depth technic... data analysis, automation, senior analyst, analytical, machine learning, data quality, continuous improvement, operations",[],8,"['data analysis', 'automation', 'senior analyst', 'analytical', 'machine learning', 'data quality', 'continuous improvement', 'operations']","data analysis, automation, senior analyst, analytical, machine learning, data quality, continuous improvement, operations"
Data Scientist-Artificial Intelligence,IBM,Data Scientist,Pune,On-site,3-7 Yrs,3,7,5.0,Not disclosed,Bachelors DegreeRequired educationRequired technical and professional expertise Proof o...,"data scientist, python, ai solutions, ai frameworks, ai, cloud platforms, machine learning, artificial intelligence",https://www.naukri.com/job-listings-data-scientist-artificial-intelligence-ibm-india-pvt-limited-pune-3-to-7-years-160226923842,"Bachelors DegreeRequired educationRequired technical and professional expertise Proof o... data scientist, python, ai solutions, ai frameworks, ai, cloud platforms, machine learning, artificial intelligence",[],8,"['data scientist', 'python', 'ai solutions', 'ai frameworks', 'ai', 'cloud platforms', 'machine learning', 'artificial intelligence']","data scientist, python, ai solutions, ai frameworks, ai, cloud platforms, machine learning, artificial intelligence"
Data Scientist-Artificial Intelligence,IBM,Data Scientist,Bengaluru,On-site,3-7 Yrs,3,7,5.0,Not disclosed,Required education . Bachelors Degree . Required technical and professional expertise ....,"data scientist, python, ai solutions, ai frameworks, 73960, ai, cloud platforms, machine learning",https://www.naukri.com/job-listings-data-scientist-artificial-intelligence-ibm-india-pvt-limited-bengaluru-3-to-7-years-200226912157,"Required education . Bachelors Degree . Required technical and professional expertise .... data scientist, python, ai solutions, ai frameworks, 73960, ai, cloud platforms, machine learning",[],8,"['data scientist', 'python', 'ai solutions', 'ai frameworks', '73960', 'ai', 'cloud platforms', 'machine learning']","data scientist, python, ai solutions, ai frameworks, 73960, ai, cloud platforms, machine learning"
Data Scientist,Razorthink,Data Scientist,Bengaluru,On-site,0-2 Yrs,0,2,1.0,Not disclosed,"Minimum Qualifications . Bachelors / Masters in a quantitative field (CS, Data Science,...","data science, langgraph, git, docker, data scientist, langchain, mlflow, hugging face",https://www.naukri.com/job-listings-data-scientist-razorthink-bengaluru-0-to-2-years-200226921572,"Minimum Qualifications . Bachelors / Masters in a quantitative field (CS, Data Science,... data science, langgraph, git, docker, data scientist, langchain, mlflow, hugging face",[],8,"['data science', 'langgraph', 'git', 'docker', 'data scientist', 'langchain', 'mlflow', 'hugging face']","data science, langgraph, git, docker, data scientist, langchain, mlflow, hugging face"
Data Scientist-Artificial Intelligence,IBM,Data Scientist,Pune,On-site,3-5 Yrs,3,5,4.0,Not disclosed,Required education . Bachelors Degree Preferred education . Masters Degree Required tec...,"data scientist, kubernetes, python, github, natural language processing, ai, react, bootstrap",https://www.naukri.com/job-listings-data-scientist-artificial-intelligence-ibm-india-pvt-limited-pune-3-to-5-years-190226930763,"Required education . Bachelors Degree Preferred education . Masters Degree Required tec... data scientist, kubernetes, python, github, natural language processing, ai, react, bootstrap",[],8,"['data scientist', 'kubernetes', 'python', 'github', 'natural language processing', 'ai', 'react', 'bootstrap']","data scientist, kubernetes, python, github, natural language processing, ai, react, bootstrap"
Data Scientist,Alstom,Data Scientist,Bengaluru,On-site,7-12 Yrs,7,12,9.5,Not disclosed,"Instead, weve listed some that we think will help you succeed and grow in this role: . ...","data scientist, python, ai, numpy, machine learning, artificial intelligence, sql, pandas",https://www.naukri.com/job-listings-data-scientist-alstom-transport-india-ltd-bengaluru-7-to-12-years-200226911931,"Instead, weve listed some that we think will help you succeed and grow in this role: . ... data scientist, python, ai, numpy, machine learning, artificial intelligence, sql, pandas",[],8,"['data scientist', 'python', 'ai', 'numpy', 'machine learning', 'artificial intelligence', 'sql', 'pandas']","data scientist, python, ai, numpy, machine learning, artificial intelligence, sql, pandas"
Data Scientist in Supply chain,EY,Data Scientist,Hyderabad,Hybrid,4-8 Yrs,4,8,6.0,Not disclosed,"Bachelor s or Master s degree in Supply Chain, Engineering, Operations, Computer Scienc...","procurement, generative ai, simulation, supply chain, optimization, data science, artificial intelligence, machine learning",https://www.naukri.com/job-listings-data-scientist-in-supply-chain-ey-hyderabad-pune-bengaluru-4-to-8-years-190226022513,"Bachelor s or Master s degree in Supply Chain, Engineering, Operations, Computer Scienc... procurement, generative ai, simulation, supply chain, optimization, data science, artificial intelligence, machine learning",[],8,"['procurement', 'generative ai', 'simulation', 'supply chain', 'optimization', 'data science', 'artificial intelligence', 'machine learning']","procurement, generative ai, simulation, supply chain, optimization, data science, artificial intelligence, machine learning"
Data Scientist-Artificial Intelligence,IBM,Data Scientist,Pune,On-site,8-10 Yrs,8,10,9.0,Not disclosed,"As a Data Scientist with expertise in Artificial Intelligence, you will skillfully com...","data scientist, kubernetes, python, github, natural language processing, ai, react, bootstrap",https://www.naukri.com/job-listings-data-scientist-artificial-intelligence-ibm-india-pvt-limited-pune-8-to-10-years-190226930984,"As a Data Scientist with expertise in Artificial Intelligence, you will skillfully com... data scientist, kubernetes, python, github, natural language processing, ai, react, bootstrap",[],8,"['data scientist', 'kubernetes', 'python', 'github', 'natural language processing', 'ai', 'react', 'bootstrap']","data scientist, kubernetes, python, github, natural language processing, ai, react, bootstrap"
Data Scientist-Artificial Intelligence,IBM,Data Scientist,Pune,On-site,8-9 Yrs,8,9,8.5,Not disclosed,"As a Data Scientist with expertise in Artificial Intelligence, you will skillfully com...","data scientist, kubernetes, python, github, natural language processing, ai, react, bootstrap",https://www.naukri.com/job-listings-data-scientist-artificial-intelligence-ibm-india-pvt-limited-pune-8-to-9-years-190226930981,"As a Data Scientist with expertise in Artificial Intelligence, you will skillfully com... data scientist, kubernetes, python, github, natural language processing, ai, react, bootstrap",[],8,"['data scientist', 'kubernetes', 'python', 'github', 'natural language processing', 'ai', 'react', 'bootstrap']","data scientist, kubernetes, python, github, natural language processing, ai, react, bootstrap"
Data Science - Data Scientist,Paytm,Data Scientist,Noida,On-site,0-3 Yrs,0,3,1.5,Not disclosed,"Design, build, evaluate and maintain ML / DL models to detect various types of risk mit...","data science, algorithms, python, scala, ai, operational risk, machine learning, user experience",https://www.naukri.com/job-listings-data-science-data-scientist-one97-communications-limited-noida-bengaluru-0-to-3-years-110226917411,"Design, build, evaluate and maintain ML / DL models to detect various types of risk mit... data science, algorithms, python, scala, ai, operational risk, machine learning, user experience",[],8,"['data science', 'algorithms', 'python', 'scala', 'ai', 'operational risk', 'machine learning', 'user experience']","data science, algorithms, python, scala, ai, operational risk, machine learning, user experience"
Data Scientist,Digital Convergence Technologies,Data Scientist,Pune,On-site,5-10 Yrs,5,10,7.5,Not disclosed,Masters degree or above in Computer Science or related fieldsThe ideal candidates shoul...,"machine learning, python, pytorch, tensorflow, generative ai, natural language processing, llm, data",https://www.naukri.com/job-listings-data-scientist-digital-convergence-technologies-pune-5-to-10-years-030226013566,"Masters degree or above in Computer Science or related fieldsThe ideal candidates shoul... machine learning, python, pytorch, tensorflow, generative ai, natural language processing, llm, data",[],8,"['machine learning', 'python', 'pytorch', 'tensorflow', 'generative ai', 'natural language processing', 'llm', 'data']","machine learning, python, pytorch, tensorflow, generative ai, natural language processing, llm, data"
Data Scientist,Tata Consultancy Services,Data Scientist,Hyderabad,On-site,10-15 Yrs,10,15,12.5,Not disclosed,"Location- Pan IndiaPreferred candidate profile  Experience using Redshift, S3, ADLS, Da...","s3, databricks engineer, redshift, sagemaker, adls, jupyter, jupyter notebook, azure data lake",https://www.naukri.com/job-listings-data-scientist-tata-consultancy-services-hyderabad-pune-bengaluru-10-to-15-years-050126025788,"Location- Pan IndiaPreferred candidate profile  Experience using Redshift, S3, ADLS, Da... s3, databricks engineer, redshift, sagemaker, adls, jupyter, jupyter notebook, azure data lake",[],8,"['s3', 'databricks engineer', 'redshift', 'sagemaker', 'adls', 'jupyter', 'jupyter notebook', 'azure data lake']","s3, databricks engineer, redshift, sagemaker, adls, jupyter, jupyter notebook, azure data lake"
Data Scientist,Persolkelly India,Data Scientist,Mumbai,On-site,4-6 Yrs,4,6,5.0,Not disclosed,As a member of the Data Science C Analytics Engagement Team your will have the follow...,"supply chain, computer science, data analysis, prototype, machine learning, schema, information technology, sql",https://www.naukri.com/job-listings-data-scientist-persolkelly-mumbai-nagpur-thane-nashik-pune-aurangabad-4-to-6-years-200226501875,"As a member of the Data Science C Analytics Engagement Team your will have the follow... supply chain, computer science, data analysis, prototype, machine learning, schema, information technology, sql",[],8,"['supply chain', 'computer science', 'data analysis', 'prototype', 'machine learning', 'schema', 'information technology', 'sql']","supply chain, computer science, data analysis, prototype, machine learning, schema, information technology, sql"
Data Scientist,Logic Planet,Data Scientist,Indore,On-site,3-6 Yrs,3,6,4.5,Not disclosed,"Bachelor s or master s in computer science, Statistics, Mathematics, Data Science, Engi...","computer science, computer vision, data science, neural networks, machine learning, algorithm development, programming, mathematics",https://www.naukri.com/job-listings-data-scientist-logicplanet-it-services-indore-pune-ahmedabad-3-to-6-years-200226502226,"Bachelor s or master s in computer science, Statistics, Mathematics, Data Science, Engi... computer science, computer vision, data science, neural networks, machine learning, algorithm development, programming, mathematics",[],8,"['computer science', 'computer vision', 'data science', 'neural networks', 'machine learning', 'algorithm development', 'programming', 'mathematics']","computer science, computer vision, data science, neural networks, machine learning, algorithm development, programming, mathematics"
Data Scientist,Logic Planet,Data Scientist,Hyderabad,On-site,3-6 Yrs,3,6,4.5,Not disclosed,"Experience with cloud computing platforms such as AWS, Azure, and GCP . Experience with...","cloud computing, gcp, agile development, cloud, data collection, data processing, model development, deployment",https://www.naukri.com/job-listings-data-scientist-logicplanet-it-services-hyderabad-pune-bengaluru-3-to-6-years-200226502249,"Experience with cloud computing platforms such as AWS, Azure, and GCP . Experience with... cloud computing, gcp, agile development, cloud, data collection, data processing, model development, deployment",[],8,"['cloud computing', 'gcp', 'agile development', 'cloud', 'data collection', 'data processing', 'model development', 'deployment']","cloud computing, gcp, agile development, cloud, data collection, data processing, model development, deployment"
Data Scientist,Atos,Data Scientist,Pune,On-site,4-7 Yrs,4,7,5.5,Not disclosed,Python Team Lead (GenAI) Experience,"continuous integration, cd, kubernetes, python, system design, microsoft azure, ci/cd, integration framework",https://www.naukri.com/job-listings-data-scientist-atos-pvt-ltd-pune-4-to-7-years-160226500894,"Python Team Lead (GenAI) Experience continuous integration, cd, kubernetes, python, system design, microsoft azure, ci/cd, integration framework",[],8,"['continuous integration', 'cd', 'kubernetes', 'python', 'system design', 'microsoft azure', 'ci/cd', 'integration framework']","continuous integration, cd, kubernetes, python, system design, microsoft azure, ci/cd, integration framework"
data scientist,CN Solutions,Data Scientist,Pune,On-site,4-6 Yrs,4,6,5.0,Not disclosed,"Candidates need to be screened on ""ML ops with recommendation engine experience, ETL, w...","sql, data science, pytorch, machine learning algorithms, aws, algorithms, python, natural language processing",https://www.naukri.com/job-listings-data-scientist-cn-solutions-pune-4-to-6-years-200226920711,"Candidates need to be screened on ""ML ops with recommendation engine experience, ETL, w... sql, data science, pytorch, machine learning algorithms, aws, algorithms, python, natural language processing",[],8,"['sql', 'data science', 'pytorch', 'machine learning algorithms', 'aws', 'algorithms', 'python', 'natural language processing']","sql, data science, pytorch, machine learning algorithms, aws, algorithms, python, natural language processing"
Data Scientist - 1,Logic Planet,Data Scientist,Hyderabad,On-site,5-10 Yrs,5,10,7.5,Not disclosed,"Experience with cloud computing platforms such as AWS, Azure, and GCP . Experience with...","cloud computing, gcp, agile development, cloud, data collection, data processing, model development, scientist 1",https://www.naukri.com/job-listings-data-scientist-1-logicplanet-it-services-hyderabad-pune-bengaluru-5-to-10-years-200226502251,"Experience with cloud computing platforms such as AWS, Azure, and GCP . Experience with... cloud computing, gcp, agile development, cloud, data collection, data processing, model development, scientist 1",[],8,"['cloud computing', 'gcp', 'agile development', 'cloud', 'data collection', 'data processing', 'model development', 'scientist 1']","cloud computing, gcp, agile development, cloud, data collection, data processing, model development, scientist 1"
Data Scientist Shalini,Logic Planet,Data Scientist,Kolkata,On-site,8-14 Yrs,8,14,11.0,Not disclosed,"Skills: System design, knowledge of cloud services, understanding of AI / ML lifecycle,...","cloud services, sap, ai solutions, ai, system design, machine learning, data science tools, microservices",https://www.naukri.com/job-listings-data-scientist-shalini-logicplanet-it-services-kolkata-mumbai-new-delhi-hyderabad-pune-chennai-bengaluru-8-to-14-years-200226504888,"Skills: System design, knowledge of cloud services, understanding of AI / ML lifecycle,... cloud services, sap, ai solutions, ai, system design, machine learning, data science tools, microservices",[],8,"['cloud services', 'sap', 'ai solutions', 'ai', 'system design', 'machine learning', 'data science tools', 'microservices']","cloud services, sap, ai solutions, ai, system design, machine learning, data science tools, microservices"
Data Scientist,Kanini Software Solutions,Data Scientist,Pune,On-site,5-10 Yrs,5,10,7.5,Not disclosed,"What You Bring . 5+ years of professional Python development experience (async, type hi...","agentic ai, generative ai, cloud, fastapi, machine learning, python, artificial intelligence, data",https://www.naukri.com/job-listings-data-scientist-kanini-software-solutions-pune-chennai-bengaluru-5-to-10-years-200226018793,"What You Bring . 5+ years of professional Python development experience (async, type hi... agentic ai, generative ai, cloud, fastapi, machine learning, python, artificial intelligence, data",[],8,"['agentic ai', 'generative ai', 'cloud', 'fastapi', 'machine learning', 'python', 'artificial intelligence', 'data']","agentic ai, generative ai, cloud, fastapi, machine learning, python, artificial intelligence, data"
Data Scientist-Artificial Intelligence,IBM,Data Scientist,Hyderabad,On-site,3-7 Yrs,3,7,5.0,Not disclosed,Bachelors DegreeMasters DegreeRequired educationPreferred educationRequired technical a...,"data scientist, python, ai solutions, ai frameworks, ai, cloud platforms, machine learning, artificial intelligence",https://www.naukri.com/job-listings-data-scientist-artificial-intelligence-ibm-india-pvt-limited-hyderabad-3-to-7-years-200226912154,"Bachelors DegreeMasters DegreeRequired educationPreferred educationRequired technical a... data scientist, python, ai solutions, ai frameworks, ai, cloud platforms, machine learning, artificial intelligence",[],8,"['data scientist', 'python', 'ai solutions', 'ai frameworks', 'ai', 'cloud platforms', 'machine learning', 'artificial intelligence']","data scientist, python, ai solutions, ai frameworks, ai, cloud platforms, machine learning, artificial intelligence"
Data Scientist-Artificial Intelligence,IBM,Data Scientist,Bengaluru,On-site,3-7 Yrs,3,7,5.0,Not disclosed,Bachelors Degree Required education Required technical and professional expertise Prefe...,"data scientist, python, ai solutions, ai frameworks, ai, cloud platforms, machine learning, artificial intelligence",https://www.naukri.com/job-listings-data-scientist-artificial-intelligence-ibm-india-pvt-limited-bengaluru-3-to-7-years-160226928821,"Bachelors Degree Required education Required technical and professional expertise Prefe... data scientist, python, ai solutions, ai frameworks, ai, cloud platforms, machine learning, artificial intelligence",[],8,"['data scientist', 'python', 'ai solutions', 'ai frameworks', 'ai', 'cloud platforms', 'machine learning', 'artificial intelligence']","data scientist, python, ai solutions, ai frameworks, ai, cloud platforms, machine learning, artificial intelligence"
Data Scientist,Ford,Data Scientist,Chennai,On-site,3-7 Yrs,3,7,5.0,Not disclosed,"Hands-on Expertise in Python programming (OOPs concepts), SQL (relational / non-relatio...","computer science, data science, neural networks, analytical, machine learning, natural language processing, data visualization, analytics",https://www.naukri.com/job-listings-data-scientist-ford-india-private-limited-chennai-3-to-7-years-200226501968,"Hands-on Expertise in Python programming (OOPs concepts), SQL (relational / non-relatio... computer science, data science, neural networks, analytical, machine learning, natural language processing, data visualization, analytics",[],8,"['computer science', 'data science', 'neural networks', 'analytical', 'machine learning', 'natural language processing', 'data visualization', 'analytics']","computer science, data science, neural networks, analytical, machine learning, natural language processing, data visualization, analytics"
Data Scientist,The Glove,Data Scientist,Pune,Hybrid,2-6 Yrs,2,6,4.0,6-12 Lacs PA,Role - Data ScientistExp - 2-6 YearsLocation - Pune / GurgaonJob Description - Work wit...,"pyspark, generative ai, python, artificial intelligence, data",https://www.naukri.com/job-listings-data-scientist-the-glove-pune-gurugram-2-to-6-years-200226008314,"Role - Data ScientistExp - 2-6 YearsLocation - Pune / GurgaonJob Description - Work wit... pyspark, generative ai, python, artificial intelligence, data",[],5,"['pyspark', 'generative ai', 'python', 'artificial intelligence', 'data']","pyspark, generative ai, python, artificial intelligence, data"
AI Product Data Scientist (Agentic Systems & Product Ecosystem),Tekskills India PVT LTD,Data Scientist,Pune,On-site,5-10 Yrs,5,10,7.5,10-20 Lacs PA,Required Skills & Qualifications Experience: 312 Years  Strong experience in Data Scien...,"data science, artificial intelligence, natural language processing, python, data, processing, system, science",https://www.naukri.com/job-listings-ai-product-data-scientist-agentic-systems-product-ecosystem-tekskills-pune-gurugram-bengaluru-5-to-10-years-180226010353,"Required Skills & Qualifications Experience: 312 Years  Strong experience in Data Scien... data science, artificial intelligence, natural language processing, python, data, processing, system, science",[],8,"['data science', 'artificial intelligence', 'natural language processing', 'python', 'data', 'processing', 'system', 'science']","data science, artificial intelligence, natural language processing, python, data, processing, system, science"
Data Scientist-Artificial Intelligence,IBM,Data Scientist,Gurugram,On-site,10-15 Yrs,10,15,12.5,Not disclosed,Advanced Packaging SME - Overall 15 plus years of Industry experience (Electronics/Semi...,"data scientist, operations, b2b, semiconductor, fabrication, design, manufacturing, mes",https://www.naukri.com/job-listings-data-scientist-artificial-intelligence-ibm-india-pvt-limited-gurugram-10-to-15-years-200226912052,"Advanced Packaging SME - Overall 15 plus years of Industry experience (Electronics/Semi... data scientist, operations, b2b, semiconductor, fabrication, design, manufacturing, mes",[],8,"['data scientist', 'operations', 'b2b', 'semiconductor', 'fabrication', 'design', 'manufacturing', 'mes']","data scientist, operations, b2b, semiconductor, fabrication, design, manufacturing, mes"
Data Scientist-Artificial Intelligence,IBM,Data Scientist,Bengaluru,On-site,5-7 Yrs,5,7,6.0,Not disclosed,Bachelors Degree . Required education Required technical and professional expertise . R...,"cloud technologies, data scientist, algorithms, python, data analytics, data pipelines, 70584, ai solutions",https://www.naukri.com/job-listings-data-scientist-artificial-intelligence-ibm-india-pvt-limited-bengaluru-5-to-7-years-160226924208,"Bachelors Degree . Required education Required technical and professional expertise . R... cloud technologies, data scientist, algorithms, python, data analytics, data pipelines, 70584, ai solutions",[],8,"['cloud technologies', 'data scientist', 'algorithms', 'python', 'data analytics', 'data pipelines', '70584', 'ai solutions']","cloud technologies, data scientist, algorithms, python, data analytics, data pipelines, 70584, ai solutions"
Data Scientist-AIML,Leading IT Service and Consulting Organization,Data Scientist,Pune,Hybrid,5-10 Yrs,5,10,7.5,Not disclosed,A 15 years full time education is required Professional & Technical Skills: - Must To H...,"data science, tensorflow, pytorch, large language model, deep learning, natural language processing, machine learning, python",https://www.naukri.com/job-listings-data-scientist-aiml-anlage-infotech-pune-5-to-10-years-180226023044,"A 15 years full time education is required Professional & Technical Skills: - Must To H... data science, tensorflow, pytorch, large language model, deep learning, natural language processing, machine learning, python",[],8,"['data science', 'tensorflow', 'pytorch', 'large language model', 'deep learning', 'natural language processing', 'machine learning', 'python']","data science, tensorflow, pytorch, large language model, deep learning, natural language processing, machine learning, python"
Data Scientist-Artificial Intelligence,IBM,Data Scientist,Bengaluru,On-site,5-7 Yrs,5,7,6.0,Not disclosed,"Work with broader team to build, analyze and improve the AI solutions. You will also w...","data scientist, algorithms, python, data analytics, data pipelines, ai solutions, ai, enterprise applications",https://www.naukri.com/job-listings-data-scientist-artificial-intelligence-ibm-india-pvt-limited-bengaluru-5-to-7-years-180226933347,"Work with broader team to build, analyze and improve the AI solutions. You will also w... data scientist, algorithms, python, data analytics, data pipelines, ai solutions, ai, enterprise applications",[],8,"['data scientist', 'algorithms', 'python', 'data analytics', 'data pipelines', 'ai solutions', 'ai', 'enterprise applications']","data scientist, algorithms, python, data analytics, data pipelines, ai solutions, ai, enterprise applications"
Data Scientist-Artificial Intelligence,IBM,Data Scientist,Bengaluru,On-site,5-7 Yrs,5,7,6.0,Not disclosed,"Work with broader team to build, analyze and improve the AI solutions.You will also wor...","data scientist, algorithms, python, data analytics, data pipelines, ai solutions, ai, enterprise applications",https://www.naukri.com/job-listings-data-scientist-artificial-intelligence-ibm-india-pvt-limited-bengaluru-5-to-7-years-180226933324,"Work with broader team to build, analyze and improve the AI solutions.You will also wor... data scientist, algorithms, python, data analytics, data pipelines, ai solutions, ai, enterprise applications",[],8,"['data scientist', 'algorithms', 'python', 'data analytics', 'data pipelines', 'ai solutions', 'ai', 'enterprise applications']","data scientist, algorithms, python, data analytics, data pipelines, ai solutions, ai, enterprise applications"
