title,company,role,city,work_mode,experience,exp_min,exp_max,exp_avg,salary,description,skills,url,combined_text,extracted_skills,skill_count,skills_list,extracted_skills_str
Data Scientist,PwC India,Data Scientist,Gurugram,Hybrid,6-11 Yrs,6,11,8.5,Not disclosed,"Skills & Experience Experience with cloud AI / ML services (AWS, Azure, GCP). Key Respo...","machine learning, data science, tensorflow, generative ai, artificial intelligence, natural language processing, deep learning, scikit-learn",https://www.naukri.com/job-listings-data-scientist-pwc-india-gurugram-bengaluru-6-to-11-years-121225037604,"Skills & Experience Experience with cloud AI / ML services (AWS, Azure, GCP). Key Respo... machine learning, data science, tensorflow, generative ai, artificial intelligence, natural language processing, deep learning, scikit-learn",[],8,"['machine learning', 'data science', 'tensorflow', 'generative ai', 'artificial intelligence', 'natural language processing', 'deep learning', 'scikit-learn']","machine learning, data science, tensorflow, generative ai, artificial intelligence, natural language processing, deep learning, scikit-learn"
Data Scientist/ML Engineer,Connectio It,Data Scientist,Hyderabad,Hybrid,6-8 Yrs,6,8,7.0,15-25 Lacs PA,"Role & responsibilities   Data Scientist /ML engineers : ML Engineer with Python, SQL, ...","ml engineer, python, machine learning, sql, azure, microsoft azure, data, machine",https://www.naukri.com/job-listings-data-scientist-ml-engineer-connectio-it-hyderabad-6-to-8-years-190226931266,"Role & responsibilities   Data Scientist /ML engineers : ML Engineer with Python, SQL, ... ml engineer, python, machine learning, sql, azure, microsoft azure, data, machine",[],8,"['ml engineer', 'python', 'machine learning', 'sql', 'azure', 'microsoft azure', 'data', 'machine']","ml engineer, python, machine learning, sql, azure, microsoft azure, data, machine"
AI Data Scientist,Mercedes Benz,Data Scientist,Bengaluru,On-site,5-7 Yrs,5,7,6.0,Not disclosed,"About the RoleWe are looking for a Data Scientist who is highly skilled in Python, Larg...","data scientist, kubernetes, aks, numpy, microservices, docker, git, data science",https://www.naukri.com/job-listings-ai-data-scientist-mercedes-benz-research-and-development-india-pvt-ltd-bengaluru-5-to-7-years-100226914504,"About the RoleWe are looking for a Data Scientist who is highly skilled in Python, Larg... data scientist, kubernetes, aks, numpy, microservices, docker, git, data science",[],8,"['data scientist', 'kubernetes', 'aks', 'numpy', 'microservices', 'docker', 'git', 'data science']","data scientist, kubernetes, aks, numpy, microservices, docker, git, data science"
Data Scientist,MNC Group,Data Scientist,Gurugram(Cyber City),On-site,0-1 Yrs,0,1,0.5,8-10 Lacs PA,Education: Bachelor s degree requiredWe re looking for someone who is not only technica...,"node.js, retrieval augmented generation, machine learning, python, gen al, predictive modeling, time series analysis, natural language processing",https://www.naukri.com/job-listings-data-scientist-persolkelly-india-gurugram-0-to-1-years-200126014641,"Education: Bachelor s degree requiredWe re looking for someone who is not only technica... node.js, retrieval augmented generation, machine learning, python, gen al, predictive modeling, time series analysis, natural language processing",[],8,"['node.js', 'retrieval augmented generation', 'machine learning', 'python', 'gen al', 'predictive modeling', 'time series analysis', 'natural language processing']","node.js, retrieval augmented generation, machine learning, python, gen al, predictive modeling, time series analysis, natural language processing"
Data Scientist / Machine Learning Engineer  - Computer Vision,Connectrz,Data Scientist,Chennai(Sriperumbudur ),On-site,3-8 Yrs,3,8,5.5,20-35 Lacs PA (Including Variable: 12.0%),Bachelors degree with 3+ years of experiencePreferred candidate profile . Required Skil...,"computer vision, deep learning, python, predictive modeling, object detection, algorithm development, opencv, vision system",https://www.naukri.com/job-listings-data-scientist-machine-learning-engineer-computer-vision-connectrz-chennai-3-to-8-years-110226029014,"Bachelors degree with 3+ years of experiencePreferred candidate profile . Required Skil... computer vision, deep learning, python, predictive modeling, object detection, algorithm development, opencv, vision system",[],8,"['computer vision', 'deep learning', 'python', 'predictive modeling', 'object detection', 'algorithm development', 'opencv', 'vision system']","computer vision, deep learning, python, predictive modeling, object detection, algorithm development, opencv, vision system"
Data Scientist-Artificial Intelligence,IBM,Data Scientist,Bengaluru,On-site,10-15 Yrs,10,15,12.5,Not disclosed,Experience with AI frameworks such as LangChain. Troubleshooting skills and creative in...,"data scientist, kubernetes, python, ai solutions, ai, business processes, cloud platforms, llm",https://www.naukri.com/job-listings-data-scientist-artificial-intelligence-ibm-india-pvt-limited-bengaluru-10-to-15-years-110226916610,"Experience with AI frameworks such as LangChain. Troubleshooting skills and creative in... data scientist, kubernetes, python, ai solutions, ai, business processes, cloud platforms, llm",[],8,"['data scientist', 'kubernetes', 'python', 'ai solutions', 'ai', 'business processes', 'cloud platforms', 'llm']","data scientist, kubernetes, python, ai solutions, ai, business processes, cloud platforms, llm"
Data Scientist,Genpact,Data Scientist,Bengaluru,Hybrid,7-10 Yrs,7,10,8.5,22.5-27.5 Lacs PA,JD-AI/ ML model development & building MLOps leveraging GCP | Collaborate & strategize ...,"data science, data scientist, machine learning, python, gcp, statistical modeling, aws, azure",https://www.naukri.com/job-listings-data-scientist-genpact-bengaluru-7-to-10-years-100226030614,"JD-AI/ ML model development & building MLOps leveraging GCP | Collaborate & strategize ... data science, data scientist, machine learning, python, gcp, statistical modeling, aws, azure",[],8,"['data science', 'data scientist', 'machine learning', 'python', 'gcp', 'statistical modeling', 'aws', 'azure']","data science, data scientist, machine learning, python, gcp, statistical modeling, aws, azure"
Full Stack Data Scientist,CAI,Data Scientist,Bengaluru,On-site,7-12 Yrs,7,12,9.5,Not disclosed,Req number: R. Employment type: Full timeExperience with MLflow for experiment tracking...,"model monitoring, cd, continuous integration, python, data, ci/cd, pyspark, aws sagemaker",https://www.naukri.com/job-listings-full-stack-data-scientist-cai-bengaluru-7-to-12-years-160226005093,"Req number: R. Employment type: Full timeExperience with MLflow for experiment tracking... model monitoring, cd, continuous integration, python, data, ci/cd, pyspark, aws sagemaker",[],8,"['model monitoring', 'cd', 'continuous integration', 'python', 'data', 'ci/cd', 'pyspark', 'aws sagemaker']","model monitoring, cd, continuous integration, python, data, ci/cd, pyspark, aws sagemaker"
Data Scientist - Bangalore,Tata Consultancy Services,Data Scientist,Bengaluru,On-site,6-11 Yrs,6,11,8.5,Not disclosed,"Location- BangaloreTech stack:  Python, Jenkins, Azure ML, AWS SageMaker, GCP Vertex AI...","sagemaker, s3, redshift, python, adls, jupyter, s, data",https://www.naukri.com/job-listings-data-scientist-bangalore-tata-consultancy-services-bengaluru-6-to-11-years-140226014874,"Location- BangaloreTech stack:  Python, Jenkins, Azure ML, AWS SageMaker, GCP Vertex AI... sagemaker, s3, redshift, python, adls, jupyter, s, data",[],7,"['sagemaker', 's3', 'redshift', 'python', 'adls', 'jupyter', 'data']","sagemaker, s3, redshift, python, adls, jupyter, data"
Data Scientist/ML Engineer,Hash Agile Technologies,Data Scientist,Hyderabad,On-site,7-10 Yrs,7,10,8.5,Not disclosed,"Role: Data ScientistLocation: Hyderabad, Telangana Department: Engineering Employment T...","machine learning, data bricks, neural networks, mlflow, networking, microsoft flow, bricks, data engineering",https://www.naukri.com/job-listings-data-scientist-ml-engineer-hash-agile-technologies-hyderabad-7-to-10-years-160226004197,"Role: Data ScientistLocation: Hyderabad, Telangana Department: Engineering Employment T... machine learning, data bricks, neural networks, mlflow, networking, microsoft flow, bricks, data engineering",[],8,"['machine learning', 'data bricks', 'neural networks', 'mlflow', 'networking', 'microsoft flow', 'bricks', 'data engineering']","machine learning, data bricks, neural networks, mlflow, networking, microsoft flow, bricks, data engineering"
Data Scientist,Cyient,Data Scientist,Bengaluru,On-site,5-10 Yrs,5,10,7.5,Not disclosed,"Strong expertise in Machine Learning, Deep Learning, and Generative AI. . Hands-on expe...","continuous integration, kubernetes, data, scikit-learn, ci/cd, tools, sql, docker",https://www.naukri.com/job-listings-data-scientist-cyient-limited-bengaluru-5-to-10-years-120226008745,"Strong expertise in Machine Learning, Deep Learning, and Generative AI. . Hands-on expe... continuous integration, kubernetes, data, scikit-learn, ci/cd, tools, sql, docker",[],8,"['continuous integration', 'kubernetes', 'data', 'scikit-learn', 'ci/cd', 'tools', 'sql', 'docker']","continuous integration, kubernetes, data, scikit-learn, ci/cd, tools, sql, docker"
Data Scientist-Artificial Intelligence,IBM,Data Scientist,Bengaluru,On-site,6-8 Yrs,6,8,7.0,Not disclosed,Bachelors Degree Masters Degree Required education Preferred education Required technic...,"data scientist, python, ai solutions, ai frameworks, ai, pyspark, cloud platforms, machine learning",https://www.naukri.com/job-listings-data-scientist-artificial-intelligence-ibm-india-pvt-limited-bengaluru-6-to-8-years-090226906067,"Bachelors Degree Masters Degree Required education Preferred education Required technic... data scientist, python, ai solutions, ai frameworks, ai, pyspark, cloud platforms, machine learning",[],8,"['data scientist', 'python', 'ai solutions', 'ai frameworks', 'ai', 'pyspark', 'cloud platforms', 'machine learning']","data scientist, python, ai solutions, ai frameworks, ai, pyspark, cloud platforms, machine learning"
Data Scientist,Amazon,Data Scientist,Bengaluru,On-site,3-8 Yrs,3,8,5.5,Not disclosed,"Masters degree in Science, Technology, Engineering, or Mathematics (STEM), or experienc...","data analysis, analytical, machine learning, perl, data mining, forecasting, product marketing, financial services",https://www.naukri.com/job-listings-data-scientist-amazon-development-centre-india-pvt-ltd-bengaluru-3-to-8-years-100226502948,"Masters degree in Science, Technology, Engineering, or Mathematics (STEM), or experienc... data analysis, analytical, machine learning, perl, data mining, forecasting, product marketing, financial services",[],8,"['data analysis', 'analytical', 'machine learning', 'perl', 'data mining', 'forecasting', 'product marketing', 'financial services']","data analysis, analytical, machine learning, perl, data mining, forecasting, product marketing, financial services"
Data Scientist / Machine Learning Engineer,LateShipment.com,Data Scientist,Chennai,On-site,5-8 Yrs,5,8,6.5,Not disclosed,"Bachelors or Masters in Computer Science, Engineering, or related field (or equivalent ...","python, c#, genai/llm tools, java, azure, crewai, netsuite erp, nltk",https://www.naukri.com/job-listings-data-scientist-machine-learning-engineer-lateshipment-com-chennai-5-to-8-years-180226929565,"Bachelors or Masters in Computer Science, Engineering, or related field (or equivalent ... python, c#, genai/llm tools, java, azure, crewai, netsuite erp, nltk",[],8,"['python', 'c#', 'genai/llm tools', 'java', 'azure', 'crewai', 'netsuite erp', 'nltk']","python, c#, genai/llm tools, java, azure, crewai, netsuite erp, nltk"
Data Scientist,Luxoft,Data Scientist,Bengaluru,On-site,5-10 Yrs,5,10,7.5,Not disclosed,We are seeking a highly skilled and motivated Data Scientist with 5+ years of experienc...,"python, numpy, sql, pandas, data science, snowflake, scikit-learn, version control",https://www.naukri.com/job-listings-data-scientist-luxoft-india-llp-bengaluru-5-to-10-years-160226939118,"We are seeking a highly skilled and motivated Data Scientist with 5+ years of experienc... python, numpy, sql, pandas, data science, snowflake, scikit-learn, version control",[],8,"['python', 'numpy', 'sql', 'pandas', 'data science', 'snowflake', 'scikit-learn', 'version control']","python, numpy, sql, pandas, data science, snowflake, scikit-learn, version control"
Data Scientist,Bahwan CyberTek,Data Scientist,Chennai,On-site,4-6 Yrs,4,6,5.0,Not disclosed,"Qualifications: . Bachelors orMasters degree in Data Science, Computer Science, Statist...","data collection, python, cloud services, data analysis, eda, data processing, llm, machine learning",https://www.naukri.com/job-listings-data-scientist-bahwan-cybertek-private-limited-chennai-4-to-6-years-160226904401,"Qualifications: . Bachelors orMasters degree in Data Science, Computer Science, Statist... data collection, python, cloud services, data analysis, eda, data processing, llm, machine learning",[],8,"['data collection', 'python', 'cloud services', 'data analysis', 'eda', 'data processing', 'llm', 'machine learning']","data collection, python, cloud services, data analysis, eda, data processing, llm, machine learning"
Data Scientist,Infosys,Data Scientist,Bengaluru,On-site,9-11 Yrs,9,11,10.0,Not disclosed,"Bachelor of Engineering, Bachelor Of Technology, Bachelor Of CompMasters degree in Comp...","data scientist, snowflake, python, natural language processing, mathematics, data warehousing, machine learning, configuration management",https://www.naukri.com/job-listings-data-scientist-infosys-limited-bengaluru-9-to-11-years-090226909092,"Bachelor of Engineering, Bachelor Of Technology, Bachelor Of CompMasters degree in Comp... data scientist, snowflake, python, natural language processing, mathematics, data warehousing, machine learning, configuration management",[],8,"['data scientist', 'snowflake', 'python', 'natural language processing', 'mathematics', 'data warehousing', 'machine learning', 'configuration management']","data scientist, snowflake, python, natural language processing, mathematics, data warehousing, machine learning, configuration management"
Data Scientist,Allcargo Logistics,Data Scientist,Mumbai,On-site,5-10 Yrs,5,10,7.5,Not disclosed,". Qualification. Primary: Masters or PhD in Data Science, Computer Science, Statistics,...","data science, artificial intelligence, machine learning, python, data, science, machine, intelligence",https://www.naukri.com/job-listings-data-scientist-allcargo-logistics-mumbai-5-to-10-years-180226005516,". Qualification. Primary: Masters or PhD in Data Science, Computer Science, Statistics,... data science, artificial intelligence, machine learning, python, data, science, machine, intelligence",[],8,"['data science', 'artificial intelligence', 'machine learning', 'python', 'data', 'science', 'machine', 'intelligence']","data science, artificial intelligence, machine learning, python, data, science, machine, intelligence"
Data Scientist,Hanker Systems (india),Data Scientist,Bengaluru,On-site,5-10 Yrs,5,10,7.5,Not disclosed,"Core Skills . Data Science Python Cloud (AWS, Azure, GCP) Deep Learning/ Natural Langua...","data scientist, python, natural language processing, generative ai, ai, python development, llm, application development",https://www.naukri.com/job-listings-data-scientist-hankersystems-india-bengaluru-5-to-10-years-190226925508,"Core Skills . Data Science Python Cloud (AWS, Azure, GCP) Deep Learning/ Natural Langua... data scientist, python, natural language processing, generative ai, ai, python development, llm, application development",[],8,"['data scientist', 'python', 'natural language processing', 'generative ai', 'ai', 'python development', 'llm', 'application development']","data scientist, python, natural language processing, generative ai, ai, python development, llm, application development"
Data Scientist,Hanker Systems (india),Data Scientist,Bengaluru,On-site,5-10 Yrs,5,10,7.5,Not disclosed,Additional Preferred Skills  Data Scientist with strong Python development skills and s...,"data science, deep learning, python, natural language processing, gcp, computer vision, ai, data scientist",https://www.naukri.com/job-listings-data-scientist-hankersystems-india-bengaluru-5-to-10-years-190226919574,"Additional Preferred Skills  Data Scientist with strong Python development skills and s... data science, deep learning, python, natural language processing, gcp, computer vision, ai, data scientist",[],8,"['data science', 'deep learning', 'python', 'natural language processing', 'gcp', 'computer vision', 'ai', 'data scientist']","data science, deep learning, python, natural language processing, gcp, computer vision, ai, data scientist"
Data Scientist | Credit Risk,Krazy Bee Services,Data Scientist,Bengaluru(Domlur),On-site,1-3 Yrs,1,3,2.0,Not disclosed,"Graduation / Post-graduation from Tier-1 institutes (IITs, ISI, DSE, NITs, etc.) Experi...","credit risk modelling, sql, scorecard, credit risk analysis, python, credit risk management, credit risk strategy, risk modeling",https://www.naukri.com/job-listings-data-scientist-credit-risk-krazy-bee-services-bengaluru-1-to-3-years-180226031425,"Graduation / Post-graduation from Tier-1 institutes (IITs, ISI, DSE, NITs, etc.) Experi... credit risk modelling, sql, scorecard, credit risk analysis, python, credit risk management, credit risk strategy, risk modeling",[],8,"['credit risk modelling', 'sql', 'scorecard', 'credit risk analysis', 'python', 'credit risk management', 'credit risk strategy', 'risk modeling']","credit risk modelling, sql, scorecard, credit risk analysis, python, credit risk management, credit risk strategy, risk modeling"
Data Scientist,Worldclass Tech Talent Pvt Ltd,Data Scientist,Pune,On-site,4-8 Yrs,4,8,6.0,Not disclosed,"You will build and ship an AI-Powered product capabilities end-to-end, turning messy fu...","data science, statistical modeling, machine learning, machine, data, modeling, science, statistics",https://www.naukri.com/job-listings-data-scientist-worldclass-tech-talent-pune-4-to-8-years-110226010286,"You will build and ship an AI-Powered product capabilities end-to-end, turning messy fu... data science, statistical modeling, machine learning, machine, data, modeling, science, statistics",[],8,"['data science', 'statistical modeling', 'machine learning', 'machine', 'data', 'modeling', 'science', 'statistics']","data science, statistical modeling, machine learning, machine, data, modeling, science, statistics"
Deputy General Manager (Data Scientist AI/ML) - Product Management,Tata Communications,Data Scientist,Chennai,On-site,15-20 Yrs,15,20,17.5,Not disclosed,"Bachelor / Master degree in Telecommunications, Computer Science, Data Science, or rela...","data scientist, python, tableau, product management, data science, predictive analytics, ai, power bi",https://www.naukri.com/job-listings-deputy-general-manager-data-scientist-ai-ml-product-management-tata-communications-ltd-chennai-15-to-20-years-170226933824,"Bachelor / Master degree in Telecommunications, Computer Science, Data Science, or rela... data scientist, python, tableau, product management, data science, predictive analytics, ai, power bi",[],8,"['data scientist', 'python', 'tableau', 'product management', 'data science', 'predictive analytics', 'ai', 'power bi']","data scientist, python, tableau, product management, data science, predictive analytics, ai, power bi"
Data Scientist - Search,Target,Data Scientist,Bengaluru,On-site,2-7 Yrs,2,7,4.5,Not disclosed,"Preferred domain experience Ability to creatively solve business problems, innovating n...","supply chain, deep learning, data science, analytical, machine learning, network security, global strategy, e-commerce",https://www.naukri.com/job-listings-data-scientist-search-target-corporation-india-pvt-ltd-bengaluru-2-to-7-years-180226500160,"Preferred domain experience Ability to creatively solve business problems, innovating n... supply chain, deep learning, data science, analytical, machine learning, network security, global strategy, e-commerce",[],8,"['supply chain', 'deep learning', 'data science', 'analytical', 'machine learning', 'network security', 'global strategy', 'e-commerce']","supply chain, deep learning, data science, analytical, machine learning, network security, global strategy, e-commerce"
Sr Data Scientist - Advanced Machine Learning,Target,Data Scientist,Bengaluru,On-site,4-9 Yrs,4,9,6.5,Not disclosed,"Overview about TII:      At Target, we have a timeless purpose and a proven strategy....","supply chain, computer science, business process, data analysis, machine learning, network security, data structures, troubleshooting",https://www.naukri.com/job-listings-sr-data-scientist-advanced-machine-learning-target-corporation-india-pvt-ltd-bengaluru-4-to-9-years-100226503258,"Overview about TII:      At Target, we have a timeless purpose and a proven strategy.... supply chain, computer science, business process, data analysis, machine learning, network security, data structures, troubleshooting",[],8,"['supply chain', 'computer science', 'business process', 'data analysis', 'machine learning', 'network security', 'data structures', 'troubleshooting']","supply chain, computer science, business process, data analysis, machine learning, network security, data structures, troubleshooting"
Data Scientist,BAY Area Technology Solutions,Data Scientist,Bengaluru,On-site,5-10 Yrs,5,10,7.5,Not disclosed,". Educational Background: Bachelors or Masters degree in Computer Science, Data Science...","machine learning, python, data analysis, natural language processing, power bi, microsoft azure, sql, r",https://www.naukri.com/job-listings-data-scientist-bay-area-technology-solutions-bengaluru-5-to-10-years-170226913585,". Educational Background: Bachelors or Masters degree in Computer Science, Data Science... machine learning, python, data analysis, natural language processing, power bi, microsoft azure, sql, r",[],7,"['machine learning', 'python', 'data analysis', 'natural language processing', 'power bi', 'microsoft azure', 'sql']","machine learning, python, data analysis, natural language processing, power bi, microsoft azure, sql"
Data Scientist,Data Economy,Data Scientist,Pune,On-site,2-3 Yrs,2,3,2.5,Not disclosed,. We are on the lookout for a resourceful and proficient AI\ Engineer \/ Developer to j...,"deep learning, networking, cloud services, machine learning, algorithm development, programming, data processing, natural language processing",https://www.naukri.com/job-listings-data-scientist-dataeconomy-pune-2-to-3-years-110226502911,". We are on the lookout for a resourceful and proficient AI\ Engineer \/ Developer to j... deep learning, networking, cloud services, machine learning, algorithm development, programming, data processing, natural language processing",[],8,"['deep learning', 'networking', 'cloud services', 'machine learning', 'algorithm development', 'programming', 'data processing', 'natural language processing']","deep learning, networking, cloud services, machine learning, algorithm development, programming, data processing, natural language processing"
Data Scientist,Black And White Business Solutions,Data Scientist,Bengaluru,Hybrid,4-9 Yrs,4,9,6.5,25-35 Lacs PA,Shift Timing: N / A. Mode of Interview: VIRTUAL Qualification: Any Graduate or AboveRel...,"nlp, generative ai, llm, machine learning, python, artificial intelligence, rag, data",https://www.naukri.com/job-listings-data-scientist-black-and-white-business-solutions-bengaluru-4-to-9-years-140126015786,"Shift Timing: N / A. Mode of Interview: VIRTUAL Qualification: Any Graduate or AboveRel... nlp, generative ai, llm, machine learning, python, artificial intelligence, rag, data",[],8,"['nlp', 'generative ai', 'llm', 'machine learning', 'python', 'artificial intelligence', 'rag', 'data']","nlp, generative ai, llm, machine learning, python, artificial intelligence, rag, data"
Data Scientist (GenAI & Databricks Platform),Multinational Company,Data Scientist,Remote,Remote,7-12 Yrs,7,12,9.5,30-35 Lacs PA,Python (PySpark preferred)  . Hands-on experience with OpenAI and / or Claude APIs,"generative ai, azure databricks, python, artificial intelligence, data, microsoft azure",https://www.naukri.com/job-listings-data-scientist-genai-databricks-platform-pyramid-it-consulting-pune-7-to-12-years-100226043711,"Python (PySpark preferred)  . Hands-on experience with OpenAI and / or Claude APIs generative ai, azure databricks, python, artificial intelligence, data, microsoft azure",[],6,"['generative ai', 'azure databricks', 'python', 'artificial intelligence', 'data', 'microsoft azure']","generative ai, azure databricks, python, artificial intelligence, data, microsoft azure"
Data Scientist,Gramener,Data Scientist,Bengaluru,On-site,5-10 Yrs,5,10,7.5,Not disclosed,Data Scientist  Work Location: Bangalore (Whitefield) What Gramener offers you Gramener...,"production support, analytical, ssrs, machine learning, data collection, qlikview, scm, analytics",https://www.naukri.com/job-listings-data-scientist-gramener-bengaluru-5-to-10-years-160226502227,"Data Scientist  Work Location: Bangalore (Whitefield) What Gramener offers you Gramener... production support, analytical, ssrs, machine learning, data collection, qlikview, scm, analytics",[],8,"['production support', 'analytical', 'ssrs', 'machine learning', 'data collection', 'qlikview', 'scm', 'analytics']","production support, analytical, ssrs, machine learning, data collection, qlikview, scm, analytics"
